{
  "canvas": {
    "height": 768,
    "width": 768
  },
  "document_id": "eaac6477-613a-4e64-9a33-3ed41cdb41e5",
  "negative_mode": "auto",
  "overlap": {
    "mode": "joint"
  },
  "prompts": {
    "background": {
      "negative_source": "busy background, furniture blocking the subjects, reflective floor",
      "positive_source": "clean neutral photography studio, soft diffused daylight, light gray backdrop"
    },
    "global": {
      "negative_source": "low quality, low resolution, blurry, malformed face, asymmetrical eyes, malformed hands, extra fingers, missing fingers, extra arms, fused bodies, conjoined bodies, duplicate person, cropped, out of frame, text, watermark, signature, illustration, painting, cartoon, anime",
      "positive_source": "photorealistic full-body fashion photograph of two distinct adult women standing close together, one woman on the left and one woman on the right, their inner hands gently touching, natural friendly interaction, both facing the camera, both completely visible from head to toe, balanced composition, natural skin texture, realistic proportions, matching neutral outfits, soft studio lighting"
    }
  },
  "regions": [
    {
      "authoring": {
        "color": "#4C78A8",
        "locked": false,
        "visible": true
      },
      "enabled": true,
      "geometry": [
        {
          "authoring": {
            "locked": false,
            "name": "Malu Left 60 Percent",
            "visible": true
          },
          "enabled": true,
          "height": 1.0,
          "id": "7edce9bf-c76a-4b2f-923f-4ca50f235be1",
          "layer_id": "7edce9bf-c76a-4b2f-923f-4ca50f235be1",
          "operation": "add",
          "type": "rect",
          "width": 0.6,
          "x": 0.0,
          "y": 0.0
        }
      ],
      "id": "75292298-c4ed-4e02-af97-7d06710b63ba",
      "mask": {
        "feather": 0.05
      },
      "name": "Left - Malu LoRA Interaction",
      "parent_region_id": null,
      "priority": 0,
      "prompts": {
        "negative_source": "dark brown or black hair, braided hair, traditional red dress",
        "positive_source": "MaluX, one adult woman standing on the left side close to the other woman, long dark blonde to light brown hair with lighter highlights, soft loose waves, relaxed middle part, white long-sleeved blouse, dark blue jeans, natural standing pose, her right hand gently touching the other woman's left hand"
      },
      "strength": 1.0
    },
    {
      "authoring": {
        "color": "#E45756",
        "locked": false,
        "visible": true
      },
      "enabled": true,
      "geometry": [
        {
          "authoring": {
            "locked": false,
            "name": "Airi Right 60 Percent",
            "visible": true
          },
          "enabled": true,
          "height": 1.0,
          "id": "f163e654-8f29-4262-8bf0-0b1618bb43c0",
          "layer_id": "f163e654-8f29-4262-8bf0-0b1618bb43c0",
          "operation": "add",
          "type": "rect",
          "width": 0.6,
          "x": 0.4,
          "y": 0.0
        }
      ],
      "id": "371e042c-56fb-43b7-9fca-2c0ebf7ba4aa",
      "mask": {
        "feather": 0.05
      },
      "name": "Right - Airi LoRA Interaction",
      "parent_region_id": null,
      "priority": 1,
      "prompts": {
        "negative_source": "blonde hair, light brown hair, middle part, black business suit",
        "positive_source": "airix, one adult woman standing on the right side close to the other woman, long dark brown hair styled half-up with braided side sections and loose wavy lengths, white long-sleeved blouse, dark blue jeans, natural standing pose, her left hand gently touching the other woman's right hand"
      },
      "strength": 1.0
    }
  ],
  "schema": "bv.regional",
  "title": "Krea 2 Malu and Airi Dual Regional LoRA 20 Percent Overlap Test",
  "version": 1
}
