{
  "canvas": {
    "height": 1024,
    "width": 1024
  },
  "document_id": "95e5b3ce-33ac-4d50-9e71-4522e9586df4",
  "negative_mode": "auto",
  "overlap": {
    "mode": "joint"
  },
  "prompts": {
    "background": {
      "negative_source": "",
      "positive_source": "simple bright interior, neutral wall, daylight"
    },
    "global": {
      "negative_source": "worst quality, low quality, blurry, malformed hands, extra fingers, missing fingers, extra arms, fused bodies, conjoined, duplicate, cropped, out of frame, text, watermark, signature, nsfw",
      "positive_source": "masterpiece, best quality, amazing quality, safe, 2girls, two distinct adult women, standing side by side, full body, facing viewer"
    }
  },
  "regions": [
    {
      "authoring": {
        "color": "#4C78A8",
        "locked": false,
        "visible": true
      },
      "enabled": true,
      "geometry": [
        {
          "authoring": {
            "locked": false,
            "name": "Nyamena Left Half",
            "visible": true
          },
          "enabled": true,
          "height": 1,
          "id": "2646ebbc-0b88-4b75-91ae-7ded24140865",
          "layer_id": "2646ebbc-0b88-4b75-91ae-7ded24140865",
          "operation": "add",
          "type": "rect",
          "width": 0.5,
          "x": 0,
          "y": 0
        }
      ],
      "id": "86b520ee-f27b-45de-9da9-bcc32d9e43ad",
      "mask": {
        "feather": 0.05
      },
      "name": "Left - Nyamena LoRA",
      "parent_region_id": null,
      "priority": 0,
      "prompts": {
        "negative_source": "",
        "positive_source": "1girl, solo, a4onyamena, standing on the left side, blonde hair, long hair, animal ears, brown eyes, tail, multicolored hair, orange hair, cat ears, cat tail, fangs, navel, midriff, cleavage, skirt, blue skirt, crop top, sleeveless, bare shoulders"
      },
      "strength": 1
    },
    {
      "authoring": {
        "color": "#E45756",
        "locked": false,
        "visible": true
      },
      "enabled": true,
      "geometry": [
        {
          "authoring": {
            "locked": false,
            "name": "Myaley Right Half",
            "visible": true
          },
          "enabled": true,
          "height": 1,
          "id": "8ceef2ed-40a9-417c-a153-ec25d766443f",
          "layer_id": "8ceef2ed-40a9-417c-a153-ec25d766443f",
          "operation": "add",
          "type": "rect",
          "width": 0.5,
          "x": 0.5,
          "y": 0
        }
      ],
      "id": "40b94ecd-7224-42af-89ab-e271a09bd5ae",
      "mask": {
        "feather": 0.05
      },
      "name": "Right - Myaley LoRA",
      "parent_region_id": null,
      "priority": 1,
      "prompts": {
        "negative_source": "",
        "positive_source": "1girl, solo, a4omyaley, standing on the right side, purple hair, short hair, animal ears, cat ears, yellow eyes, cat tail, tail, fang, animal ear fluff, cat girl, fur skin, purple fur, belt, crop top, brown crop top, brown skirt, navel, midriff, boots"
      },
      "strength": 1
    }
  ],
  "schema": "bv.regional",
  "title": "Anima Nyamena and Myaley Dual Regional LoRA Test",
  "version": 1
}
