{
  "canvas": {
    "height": 1024,
    "width": 1024
  },
  "document_id": "f24a5290-a5ed-4a0b-a403-1c92da9fcada",
  "negative_mode": "auto",
  "overlap": {
    "mode": "joint"
  },
  "prompts": {
    "background": {
      "negative_source": "The ground is wet or reflective.",
      "positive_source": ""
    },
    "global": {
      "negative_source": "The image is low resolution. Faces or eyes are malformed, asymmetrical, distorted, or poorly rendered.",
      "positive_source": "A full-body photograph of two adult women standing side by side in front of an elegant castle. Both women are completely visible from head to toe and face the camera. The composition is balanced, with one woman on the left and one woman on the right. The scene is family-friendly and naturally lit."
    }
  },
  "regions": [
    {
      "authoring": {
        "color": "#4C78A8",
        "locked": false,
        "visible": true
      },
      "enabled": true,
      "geometry": [
        {
          "authoring": {
            "locked": false,
            "name": "Rectangle 1",
            "visible": true
          },
          "enabled": true,
          "height": 0.8251953125,
          "id": "ac5c3469-a80f-4349-a504-9369ccdb6859",
          "layer_id": "ac5c3469-a80f-4349-a504-9369ccdb6859",
          "operation": "add",
          "type": "rect",
          "width": 0.3642578125,
          "x": 0.515625,
          "y": 0.1748046875
        }
      ],
      "id": "26293499-b767-47ca-994b-b7ab1a705ef9",
      "mask": {
        "feather": 0.01
      },
      "name": "Right Woman",
      "parent_region_id": null,
      "priority": 0,
      "prompts": {
        "negative_source": "Her face or eyes are malformed, distorted, asymmetrical, or poorly rendered.",
        "positive_source": "The woman on the right has black hair and wears an elegant tailored black wedding suit with a formal jacket and matching trousers."
      },
      "strength": 0.8
    },
    {
      "authoring": {
        "color": "#E45756",
        "locked": false,
        "visible": true
      },
      "enabled": true,
      "geometry": [
        {
          "authoring": {
            "locked": false,
            "name": "Rectangle 1",
            "visible": true
          },
          "enabled": true,
          "height": 0.8203125,
          "id": "36066674-35ba-472d-8a4d-17ad132d6c54",
          "layer_id": "36066674-35ba-472d-8a4d-17ad132d6c54",
          "operation": "add",
          "type": "rect",
          "width": 0.41992187499999994,
          "x": 0.1533203125,
          "y": 0.1796875
        }
      ],
      "id": "f6aaeb5b-62af-44da-83bd-0911275f32e3",
      "mask": {
        "feather": 0.01
      },
      "name": "Left Woman",
      "parent_region_id": null,
      "priority": 1,
      "prompts": {
        "negative_source": "Her face or eyes are malformed, distorted, asymmetrical, or poorly rendered.",
        "positive_source": "The woman on the left has blonde hair and wears a long white bridal wedding gown with elegant lace details."
      },
      "strength": 0.8
    }
  ],
  "schema": "bv.regional",
  "title": "Krea 2 - Two Women at a Castle",
  "version": 1
}
