{
  "schema": "bv.regional",
  "version": 1,
  "document_id": "93fcf9da-2b78-4cfb-aa86-a37657c10794",
  "title": "FLUX.2 Klein 9B Attention - Attribute Separation Test",
  "canvas": {
    "width": 1024,
    "height": 1024
  },
  "prompts": {
    "global": {
      "positive_source": "A polished cinematic science-fiction photograph of exactly two adult female explorers standing side by side, both completely visible from head to toe and facing the camera. Keep a narrow visible gap between them and use a balanced, symmetrical composition.",
      "negative_source": ""
    },
    "background": {
      "positive_source": "The explorers stand inside a dark lunar research station with panoramic windows. Earth is visible in space behind them. The metallic floor has subtle reflections and cool cinematic rim lighting.",
      "negative_source": ""
    }
  },
  "negative_mode": "zero_out",
  "overlap": {
    "mode": "joint"
  },
  "regions": [
    {
      "id": "426ed05a-4b83-47df-a973-3694726f0560",
      "name": "Left - White and Cyan Explorer",
      "parent_region_id": null,
      "enabled": true,
      "strength": 0.9,
      "priority": 0,
      "prompts": {
        "positive_source": "The explorer on the left has a short silver bob haircut and pale skin. She wears a clean matte-white armored spacesuit with cyan luminous seams, cyan gloves, and cyan boots. Her suit contains no orange parts.",
        "negative_source": ""
      },
      "mask": {
        "feather": 0.015
      },
      "geometry": [
        {
          "id": "a705071a-7836-4179-a7b0-27331e9c19f9",
          "layer_id": "a705071a-7836-4179-a7b0-27331e9c19f9",
          "type": "rect",
          "operation": "add",
          "enabled": true,
          "x": 0.05,
          "y": 0.12,
          "width": 0.5,
          "height": 0.83,
          "authoring": {
            "name": "Left character area",
            "visible": true,
            "locked": false
          }
        }
      ],
      "authoring": {
        "visible": true,
        "locked": false,
        "color": "#32C7D9"
      }
    },
    {
      "id": "705a7337-69ab-48ac-9511-d78f63c13d35",
      "name": "Right - Black and Orange Explorer",
      "parent_region_id": null,
      "enabled": true,
      "strength": 0.9,
      "priority": 1,
      "prompts": {
        "positive_source": "The explorer on the right has long dark-brown hair and warm olive skin. She wears a glossy black armored spacesuit with vivid orange panels, orange gloves, and orange boots. Her suit contains no cyan parts.",
        "negative_source": ""
      },
      "mask": {
        "feather": 0.015
      },
      "geometry": [
        {
          "id": "62588575-c1ed-43a4-b980-ec3ed7b1898f",
          "layer_id": "62588575-c1ed-43a4-b980-ec3ed7b1898f",
          "type": "rect",
          "operation": "add",
          "enabled": true,
          "x": 0.45,
          "y": 0.12,
          "width": 0.5,
          "height": 0.83,
          "authoring": {
            "name": "Right character area",
            "visible": true,
            "locked": false
          }
        }
      ],
      "authoring": {
        "visible": true,
        "locked": false,
        "color": "#F28E2B"
      }
    }
  ]
}
