{
  "schema": "bv.regional",
  "version": 1,
  "document_id": "8f2d7f16-13fd-4cd2-a111-381d0580c542",
  "title": "SDXL Attention - Attribute Separation Test",
  "canvas": {
    "width": 1024,
    "height": 1024
  },
  "prompts": {
    "global": {
      "positive_source": "masterpiece, best quality, absurdres, newest, two adult women, 2girls, standing side by side, full body, both completely visible, facing viewer, visible space between them, symmetrical composition, SFW",
      "negative_source": "worst quality, low quality, lowres, blurry, bad anatomy, bad hands, extra fingers, missing fingers, extra limbs, fused bodies, merged bodies, duplicate person, third person, cropped, out of frame, text, watermark, logo, NSFW"
    },
    "background": {
      "positive_source": "grand glass conservatory interior, pale stone floor, tall arched windows, soft morning sunlight, flowering plants in the distance",
      "negative_source": "forest, meadow, outdoor landscape, dark background"
    }
  },
  "negative_mode": "prompt",
  "overlap": {
    "mode": "joint"
  },
  "regions": [
    {
      "id": "22aa086f-4be6-437c-b2bd-345e50257f11",
      "name": "Left - Crimson Knight",
      "parent_region_id": null,
      "enabled": true,
      "strength": 0.9,
      "priority": 0,
      "prompts": {
        "positive_source": "1girl, adult woman, short crimson hair, emerald green eyes, white ceremonial armor with red accents, red cape, silver gauntlets",
        "negative_source": "blue hair, blue eyes, black dress, gold jewelry"
      },
      "mask": {
        "feather": 0.015
      },
      "geometry": [
        {
          "id": "d1640495-e167-4764-80de-86b99917d9ae",
          "layer_id": "d1640495-e167-4764-80de-86b99917d9ae",
          "type": "rect",
          "operation": "add",
          "enabled": true,
          "x": 0.06,
          "y": 0.13,
          "width": 0.47,
          "height": 0.82,
          "authoring": {
            "name": "Left character area",
            "visible": true,
            "locked": false
          }
        }
      ],
      "authoring": {
        "visible": true,
        "locked": false,
        "color": "#E45756"
      }
    },
    {
      "id": "b15093cc-c232-434c-81d9-6636cc24704f",
      "name": "Right - Azure Mage",
      "parent_region_id": null,
      "enabled": true,
      "strength": 0.9,
      "priority": 1,
      "prompts": {
        "positive_source": "1girl, adult woman, very long cobalt blue hair, bright amber eyes, black gothic dress with gold embroidery, gold jewelry, black gloves",
        "negative_source": "red hair, green eyes, white armor, red cape"
      },
      "mask": {
        "feather": 0.015
      },
      "geometry": [
        {
          "id": "fb8b4bd1-7fe2-496b-a625-63b84094bd45",
          "layer_id": "fb8b4bd1-7fe2-496b-a625-63b84094bd45",
          "type": "rect",
          "operation": "add",
          "enabled": true,
          "x": 0.47,
          "y": 0.13,
          "width": 0.47,
          "height": 0.82,
          "authoring": {
            "name": "Right character area",
            "visible": true,
            "locked": false
          }
        }
      ],
      "authoring": {
        "visible": true,
        "locked": false,
        "color": "#4C78A8"
      }
    }
  ]
}
