{
  "canvas": {
    "height": 1024,
    "width": 1024
  },
  "document_id": "f122d4c8-8982-47bb-bb9f-8ad35ff30f26",
  "negative_mode": "auto",
  "overlap": {
    "mode": "joint"
  },
  "prompts": {
    "background": {
      "negative_source": "",
      "positive_source": "simple garden background, daylight"
    },
    "global": {
      "negative_source": "worst quality, low quality, blurry, malformed hands, extra fingers, missing fingers, extra arms, fused bodies, conjoined, duplicate, cropped, out of frame, text, watermark, signature, nsfw",
      "positive_source": "masterpiece, best quality, amazing quality, safe, 2girls, two distinct women, standing side by side, full body"
    }
  },
  "regions": [
    {
      "authoring": {
        "color": "#4C78A8",
        "locked": false,
        "visible": true
      },
      "enabled": true,
      "geometry": [
        {
          "authoring": {
            "locked": false,
            "name": "Left Half",
            "visible": true
          },
          "enabled": true,
          "height": 1,
          "id": "764c2bbc-4271-4518-85ef-15d94094b366",
          "layer_id": "764c2bbc-4271-4518-85ef-15d94094b366",
          "operation": "add",
          "type": "rect",
          "width": 0.48,
          "x": 0.01,
          "y": 0
        }
      ],
      "id": "48327fb8-a780-4205-ad00-16e761ef83ba",
      "mask": {
        "feather": 0.02
      },
      "name": "Left - LoRA Trigger",
      "parent_region_id": null,
      "priority": 0,
      "prompts": {
        "negative_source": "",
        "positive_source": "1girl, solo, SerafinadeLavillant, standing on the left side, facing viewer"
      },
      "strength": 1
    },
    {
      "authoring": {
        "color": "#E45756",
        "locked": false,
        "visible": true
      },
      "enabled": true,
      "geometry": [
        {
          "authoring": {
            "locked": false,
            "name": "Right Half",
            "visible": true
          },
          "enabled": true,
          "height": 1,
          "id": "cbf4ea89-4f16-4346-b746-162852f782b0",
          "layer_id": "cbf4ea89-4f16-4346-b746-162852f782b0",
          "operation": "add",
          "type": "rect",
          "width": 0.48,
          "x": 0.51,
          "y": 0
        }
      ],
      "id": "b33d8a13-3441-4134-b0a8-694326662b3f",
      "mask": {
        "feather": 0.02
      },
      "name": "Right - No LoRA Trigger",
      "parent_region_id": null,
      "priority": 1,
      "prompts": {
        "negative_source": "",
        "positive_source": "1girl, solo, short black hair, green eyes, red dress, standing on the right side, facing viewer"
      },
      "strength": 1
    }
  ],
  "schema": "bv.regional",
  "title": "Illustrious Two Women Regional LoRA Feather Test",
  "version": 1
}
