{
  "canvas": {
    "height": 1024,
    "width": 1024
  },
  "document_id": "0c018421-2535-45e6-b0b7-d498c5894fa3",
  "negative_mode": "auto",
  "overlap": {
    "mode": "joint"
  },
  "prompts": {
    "background": {
      "negative_source": "",
      "positive_source": "futuristic space station interior, panoramic windows, stars and planet visible outside, metallic walls, cinematic ambient lighting"
    },
    "global": {
      "negative_source": "lowres, blurry, bad anatomy, bad hands, malformed hands, extra fingers, missing fingers, extra limbs, fused bodies, duplicate person, cropped, out of frame, text, watermark, nsfw",
      "positive_source": "masterpiece, best quality, 2girls, two distinct women, standing side by side, full body, both completely visible, facing viewer, visible space between them, symmetrical composition, sfw"
    }
  },
  "regions": [
    {
      "authoring": {
        "color": "#4C78A8",
        "locked": false,
        "visible": true
      },
      "enabled": true,
      "geometry": [
        {
          "authoring": {
            "locked": false,
            "name": "Right character area",
            "visible": true
          },
          "enabled": true,
          "height": 0.82,
          "id": "d923275b-0a4b-4fcb-b9d9-c2a50db35841",
          "layer_id": "d923275b-0a4b-4fcb-b9d9-c2a50db35841",
          "operation": "add",
          "type": "rect",
          "width": 0.39,
          "x": 0.54,
          "y": 0.15
        }
      ],
      "id": "18d36d90-bffd-4f6a-824a-e24fd76d954e",
      "mask": {
        "feather": 0.015
      },
      "name": "Right - Blue Hair",
      "parent_region_id": null,
      "priority": 0,
      "prompts": {
        "negative_source": "",
        "positive_source": "1girl, solo focus, long vivid blue hair, blue eyes, white futuristic spacesuit, cyan glowing details, standing, full body, facing viewer"
      },
      "strength": 1.0
    },
    {
      "authoring": {
        "color": "#E45756",
        "locked": false,
        "visible": true
      },
      "enabled": true,
      "geometry": [
        {
          "authoring": {
            "locked": false,
            "name": "Left character area",
            "visible": true
          },
          "enabled": true,
          "height": 0.82,
          "id": "a8286329-5a63-4414-910e-e87003cc6f8a",
          "layer_id": "a8286329-5a63-4414-910e-e87003cc6f8a",
          "operation": "add",
          "type": "rect",
          "width": 0.39,
          "x": 0.07,
          "y": 0.15
        }
      ],
      "id": "8070709f-4fa9-46af-8733-55cc56616f29",
      "mask": {
        "feather": 0.015
      },
      "name": "Left - Red Hair",
      "parent_region_id": null,
      "priority": 1,
      "prompts": {
        "negative_source": "",
        "positive_source": "1girl, solo focus, short vivid red hair, green eyes, black futuristic spacesuit, orange glowing details, standing, full body, facing viewer"
      },
      "strength": 1.0
    }
  ],
  "schema": "bv.regional",
  "title": "Anima - Two Characters in a Space Station",
  "version": 1
}
